{
  "schema_version": 1,
  "generated_at": "2026-10-16T11:48:04Z",
  "data_through": "2026-10-16",
  "method": {
    "origins": "first of every month from 2013-01-01, refit on data strictly before each origin",
    "error_unit": "log10(actual / forecast); *_mae_factor = 10^mean|error| (x2.0 = typically off by a factor of 2 either way)",
    "caveat": "monthly origins overlap heavily -- approx_independent_windows is the honest sample size, and it is small."
  },
  "horizons": [
    {
      "horizon_days": 365,
      "n_origins": 154,
      "approx_independent_windows": 12.8,
      "trend_mae_factor": 1.994,
      "trend_bias_pct": -15.9,
      "random_walk_mae_factor": 2.393,
      "coverage_outer": 0.8442,
      "coverage_inner": 0.6688,
      "coverage_gaussian_2sigma": 0.9545,
      "share_below_outer": 0.1429,
      "share_above_outer": 0.013
    },
    {
      "horizon_days": 730,
      "n_origins": 142,
      "approx_independent_windows": 5.9,
      "trend_mae_factor": 1.824,
      "trend_bias_pct": -26.0,
      "random_walk_mae_factor": 3.167,
      "coverage_outer": 0.8662,
      "coverage_inner": 0.7887,
      "coverage_gaussian_2sigma": 0.9437,
      "share_below_outer": 0.1338,
      "share_above_outer": 0.0
    },
    {
      "horizon_days": 1461,
      "n_origins": 118,
      "approx_independent_windows": 2.4,
      "trend_mae_factor": 1.779,
      "trend_bias_pct": -23.2,
      "random_walk_mae_factor": 8.559,
      "coverage_outer": 0.9068,
      "coverage_inner": 0.7712,
      "coverage_gaussian_2sigma": 0.9746,
      "share_below_outer": 0.0932,
      "share_above_outer": 0.0
    }
  ],
  "short_term": [
    {
      "horizon_days": 90,
      "n_origins": 163,
      "trend_mae_factor": 1.813,
      "trend_plus_ar1_mae_factor": 1.435,
      "random_walk_mae_factor": 1.419,
      "ar1_coverage_68": 0.8344,
      "ar1_coverage_95": 0.9816
    },
    {
      "horizon_days": 180,
      "n_origins": 160,
      "trend_mae_factor": 1.896,
      "trend_plus_ar1_mae_factor": 1.687,
      "random_walk_mae_factor": 1.716,
      "ar1_coverage_68": 0.75,
      "ar1_coverage_95": 0.9812
    },
    {
      "horizon_days": 365,
      "n_origins": 154,
      "trend_mae_factor": 1.994,
      "trend_plus_ar1_mae_factor": 1.974,
      "random_walk_mae_factor": 2.393,
      "ar1_coverage_68": 0.6688,
      "ar1_coverage_95": 0.961
    }
  ],
  "scenario": [
    {
      "horizon_days": 365,
      "n_origins": 82,
      "full_history_mae_factor": 1.577,
      "full_history_bias_pct": -15.1,
      "recent_window_mae_factor": 1.749,
      "recent_window_bias_pct": -10.4
    },
    {
      "horizon_days": 730,
      "n_origins": 70,
      "full_history_mae_factor": 1.574,
      "full_history_bias_pct": -14.7,
      "recent_window_mae_factor": 1.52,
      "recent_window_bias_pct": -10.2
    },
    {
      "horizon_days": 1461,
      "n_origins": 46,
      "full_history_mae_factor": 1.548,
      "full_history_bias_pct": -34.0,
      "recent_window_mae_factor": 1.973,
      "recent_window_bias_pct": -34.8
    }
  ],
  "signals": [
    {
      "signal": "power_law_z_realtime",
      "n_months": 154,
      "first_origin": "2013-01-01",
      "spearman_vs_fwd_1y": -0.512,
      "approx_independent_windows": 12.8
    },
    {
      "signal": "mayer_multiple",
      "n_months": 154,
      "first_origin": "2013-01-01",
      "spearman_vs_fwd_1y": 0.167,
      "approx_independent_windows": 12.8
    },
    {
      "signal": "wma200_distance",
      "n_months": 136,
      "first_origin": "2014-07-01",
      "spearman_vs_fwd_1y": -0.494,
      "approx_independent_windows": 11.3
    },
    {
      "signal": "price_vs_hashrate_fit",
      "n_months": 154,
      "first_origin": "2013-01-01",
      "spearman_vs_fwd_1y": -0.305,
      "approx_independent_windows": 12.8
    },
    {
      "signal": "fear_greed",
      "n_months": 92,
      "first_origin": "2018-03-01",
      "spearman_vs_fwd_1y": 0.064,
      "approx_independent_windows": 7.6
    }
  ],
  "z_buckets": [
    {
      "z_low": -99.0,
      "z_high": -1.0,
      "n_months": 15,
      "episodes": 3,
      "median_fwd_1y_pct": 130.3,
      "share_negative": 0.0
    },
    {
      "z_low": -1.0,
      "z_high": -0.5,
      "n_months": 36,
      "episodes": 7,
      "median_fwd_1y_pct": 127.2,
      "share_negative": 0.028
    },
    {
      "z_low": -0.5,
      "z_high": 0.0,
      "n_months": 34,
      "episodes": 8,
      "median_fwd_1y_pct": 143.4,
      "share_negative": 0.147
    },
    {
      "z_low": 0.0,
      "z_high": 0.5,
      "n_months": 33,
      "episodes": 10,
      "median_fwd_1y_pct": -6.3,
      "share_negative": 0.515
    },
    {
      "z_low": 0.5,
      "z_high": 1.0,
      "n_months": 21,
      "episodes": 6,
      "median_fwd_1y_pct": -40.7,
      "share_negative": 0.571
    },
    {
      "z_low": 1.0,
      "z_high": 99.0,
      "n_months": 15,
      "episodes": 5,
      "median_fwd_1y_pct": -56.2,
      "share_negative": 0.8
    }
  ],
  "miss_by_year": [
    {
      "year": 2013,
      "n": 12,
      "mae_factor": 3.234,
      "bias_pct": 219.4
    },
    {
      "year": 2014,
      "n": 12,
      "mae_factor": 4.514,
      "bias_pct": -77.8
    },
    {
      "year": 2015,
      "n": 12,
      "mae_factor": 3.845,
      "bias_pct": -74.0
    },
    {
      "year": 2016,
      "n": 12,
      "mae_factor": 1.818,
      "bias_pct": 3.1
    },
    {
      "year": 2017,
      "n": 12,
      "mae_factor": 2.29,
      "bias_pct": 121.2
    },
    {
      "year": 2018,
      "n": 12,
      "mae_factor": 1.338,
      "bias_pct": -20.5
    },
    {
      "year": 2019,
      "n": 12,
      "mae_factor": 1.383,
      "bias_pct": -26.9
    },
    {
      "year": 2020,
      "n": 12,
      "mae_factor": 2.14,
      "bias_pct": 114.0
    },
    {
      "year": 2021,
      "n": 12,
      "mae_factor": 1.674,
      "bias_pct": -18.3
    },
    {
      "year": 2022,
      "n": 12,
      "mae_factor": 2.102,
      "bias_pct": -52.4
    },
    {
      "year": 2023,
      "n": 12,
      "mae_factor": 1.201,
      "bias_pct": -14.3
    },
    {
      "year": 2024,
      "n": 12,
      "mae_factor": 1.093,
      "bias_pct": 2.9
    },
    {
      "year": 2025,
      "n": 10,
      "mae_factor": 1.812,
      "bias_pct": -44.8
    }
  ],
  "per_origin_1y": [
    {
      "origin": "2013-01-01",
      "target": "2014-01-01",
      "trend": 73.74,
      "actual": 732.0,
      "miss_log10": 0.9968,
      "inside_outer": false
    },
    {
      "origin": "2013-02-01",
      "target": "2014-02-01",
      "trend": 75.65,
      "actual": 803.0,
      "miss_log10": 1.0259,
      "inside_outer": false
    },
    {
      "origin": "2013-03-01",
      "target": "2014-03-01",
      "trend": 82.05,
      "actual": 553.0,
      "miss_log10": 0.8286,
      "inside_outer": true
    },
    {
      "origin": "2013-04-01",
      "target": "2014-04-01",
      "trend": 97.86,
      "actual": 457.49,
      "miss_log10": 0.6698,
      "inside_outer": true
    },
    {
      "origin": "2013-05-01",
      "target": "2014-05-01",
      "trend": 126.36,
      "actual": 452.03,
      "miss_log10": 0.5535,
      "inside_outer": true
    },
    {
      "origin": "2013-06-01",
      "target": "2014-06-01",
      "trend": 157.98,
      "actual": 626.5,
      "miss_log10": 0.5983,
      "inside_outer": true
    },
    {
      "origin": "2013-07-01",
      "target": "2014-07-01",
      "trend": 188.27,
      "actual": 638.99,
      "miss_log10": 0.5307,
      "inside_outer": true
    },
    {
      "origin": "2013-08-01",
      "target": "2014-08-01",
      "trend": 215.46,
      "actual": 582.04,
      "miss_log10": 0.4316,
      "inside_outer": true
    },
    {
      "origin": "2013-09-01",
      "target": "2014-09-01",
      "trend": 246.89,
      "actual": 478.87,
      "miss_log10": 0.2877,
      "inside_outer": true
    },
    {
      "origin": "2013-10-01",
      "target": "2014-10-01",
      "trend": 281.5,
      "actual": 390.18,
      "miss_log10": 0.1418,
      "inside_outer": true
    },
    {
      "origin": "2013-11-01",
      "target": "2014-11-01",
      "trend": 323.31,
      "actual": 337.79,
      "miss_log10": 0.019,
      "inside_outer": true
    },
    {
      "origin": "2013-12-01",
      "target": "2014-12-01",
      "trend": 405.12,
      "actual": 376.03,
      "miss_log10": -0.0324,
      "inside_outer": true
    },
    {
      "origin": "2014-01-01",
      "target": "2015-01-01",
      "trend": 527.09,
      "actual": 320.97,
      "miss_log10": -0.2154,
      "inside_outer": true
    },
    {
      "origin": "2014-02-01",
      "target": "2015-02-01",
      "trend": 669.45,
      "actual": 219.25,
      "miss_log10": -0.4848,
      "inside_outer": false
    },
    {
      "origin": "2014-03-01",
      "target": "2015-03-01",
      "trend": 799.58,
      "actual": 253.5,
      "miss_log10": -0.4989,
      "inside_outer": false
    },
    {
      "origin": "2014-04-01",
      "target": "2015-04-01",
      "trend": 945.24,
      "actual": 243.63,
      "miss_log10": -0.5888,
      "inside_outer": false
    },
    {
      "origin": "2014-05-01",
      "target": "2015-05-01",
      "trend": 1070.54,
      "actual": 235.97,
      "miss_log10": -0.6567,
      "inside_outer": false
    },
    {
      "origin": "2014-06-01",
      "target": "2015-06-01",
      "trend": 1205.21,
      "actual": 228.34,
      "miss_log10": -0.7225,
      "inside_outer": false
    },
    {
      "origin": "2014-07-01",
      "target": "2015-07-01",
      "trend": 1362.07,
      "actual": 262.43,
      "miss_log10": -0.7152,
      "inside_outer": false
    },
    {
      "origin": "2014-08-01",
      "target": "2015-08-01",
      "trend": 1528.36,
      "actual": 284.31,
      "miss_log10": -0.7304,
      "inside_outer": false
    },
    {
      "origin": "2014-09-01",
      "target": "2015-09-01",
      "trend": 1677.33,
      "actual": 230.25,
      "miss_log10": -0.8624,
      "inside_outer": false